ID,Level,Title,Definition,Reviewer Feedback
1.4.2,Branch,Obstetric Anesthesia,"Labor analgesia, cesarean delivery anesthesia, high-risk obstetric management, and maternal-fetal physiologic considerations.",
1.4.2-1,Topic Domain,Maternal Physiologic Changes of Pregnancy,"Cardiovascular, respiratory, gastrointestinal, and hematologic adaptations of pregnancy.",
1.4.2-2,Topic Domain,Labor Epidural Analgesia,"Timing, technique, drug selection, and maintenance of labor epidural analgesia.",
1.4.2-3,Topic Domain,Cesarean Delivery Anesthesia,"Spinal, epidural, and combined spinal-epidural techniques for cesarean section.",
1.4.2-4,Topic Domain,High-Risk Obstetric Anesthesia,"Anesthetic management of preeclampsia, placenta accreta spectrum, cardiac disease in pregnancy, and morbid obesity.",
1.4.2-5,Topic Domain,Obstetric Hemorrhage Management,"Recognition and management of postpartum hemorrhage, uterotonic medications, massive transfusion in obstetrics.",
1.4.2-6,Topic Domain,Fetal Considerations and Neonatal Resuscitation,"Uteroplacental circulation, fetal heart rate interpretation, drug transfer across the placenta.",
1.4.2-7,Topic Domain,Non-Obstetric Surgery During Pregnancy,"Anesthetic considerations for pregnant patients undergoing non-obstetric surgery.",
1.4.2-8,Topic Domain,Obstetric Emergencies and Crisis Management,"Emergency cesarean delivery, maternal cardiac arrest, amniotic fluid embolism, and umbilical cord prolapse.",
1.4.3,Branch,Cardiac Vascular and Thoracic Anesthesia,"Anesthesia for cardiac surgery, major vascular procedures, and thoracic surgery including one-lung ventilation and cardiopulmonary bypass.",
1.4.3-1,Topic Domain,Cardiopulmonary Bypass Principles,"CPB circuit components, anticoagulation management, myocardial protection, and physiologic effects of bypass.",
1.4.3-2,Topic Domain,Anesthesia for Coronary Artery Surgery,"Hemodynamic goals for CABG, managing myocardial ischemia, off-pump considerations.",
1.4.3-3,Topic Domain,Valvular Heart Disease Anesthesia,"Hemodynamic management for stenotic and regurgitant lesions of aortic, mitral, and tricuspid valves.",
1.4.3-4,Topic Domain,Thoracic Surgery and One-Lung Ventilation,"Double-lumen tube placement and confirmation, bronchial blocker alternatives, and physiologic management during one-lung ventilation.",
1.4.3-5,Topic Domain,Aortic Surgery Anesthesia,"Anesthetic management for ascending, arch, and descending thoracic aortic surgery.",
1.4.3-6,Topic Domain,Peripheral Vascular Surgery Considerations,"Anesthetic approach to carotid endarterectomy, abdominal aortic aneurysm repair, and lower extremity revascularization.",
1.4.3-7,Topic Domain,Advanced Cardiac Monitoring and TEE,"Intraoperative TEE for cardiac surgery, pulmonary artery catheter interpretation, and real-time hemodynamic assessment.",
1.4.3-8,Topic Domain,Cardiac ERAS and Fast-Track Recovery,"Enhanced recovery protocols for cardiac surgery including early extubation, multimodal analgesia, and goal-directed fluid therapy.",
1.4.4,Branch,Neuroanesthesia,"Anesthesia for craniotomy, spine surgery, and neurointerventional procedures including cerebral physiology and intracranial pressure management.",
1.4.4-1,Topic Domain,Cerebral Physiology and Neuroprotection,"Cerebral blood flow regulation, autoregulation, intracranial pressure dynamics, and the effects of anesthetic agents on cerebral metabolism.",
1.4.4-2,Topic Domain,Anesthesia for Craniotomy,"Anesthetic management for supratentorial and infratentorial procedures, brain tumor resection, and intracranial aneurysm clipping.",
1.4.4-3,Topic Domain,Spine Surgery Anesthesia,"Anesthetic considerations for cervical, thoracic, and lumbar spine surgery.",
1.4.4-4,Topic Domain,Neurointerventional Anesthesia,"Anesthesia for endovascular coiling, thrombectomy, and other neurointerventional procedures.",
1.4.4-5,Topic Domain,Neurophysiologic Monitoring Integration,"Anesthetic effects on SSEPs, MEPs, and EEG.",
1.4.4-6,Topic Domain,Awake Craniotomy and Functional Neurosurgery,"Patient selection, sedation techniques, and managing the awake-asleep-awake approach.",
1.4.5,Branch,Geriatric Trauma and High-Acuity Patient Care,"Anesthesia for elderly patients, trauma resuscitation, and management of critically ill or medically complex patients.",
1.4.5-1,Topic Domain,Geriatric Physiologic Changes and Pharmacology,"Age-related changes in cardiovascular, respiratory, renal, and hepatic function affecting anesthetic management.",
1.4.5-2,Topic Domain,Perioperative Cognitive Dysfunction and Delirium,"Risk factors for postoperative delirium and cognitive dysfunction, prevention strategies.",
1.4.5-3,Topic Domain,Trauma Resuscitation and Damage Control Anesthesia,"Anesthetic management of the trauma patient including permissive hypotension, massive transfusion, and damage control surgery principles.",
1.4.5-4,Topic Domain,Burn Patient Anesthesia,"Pathophysiology of burn injury, airway considerations, fluid resuscitation, and pharmacokinetic changes.",
1.4.5-5,Topic Domain,Sepsis and Critical Illness Anesthesia,"Anesthetic considerations for septic patients, hemodynamic optimization, and adrenal insufficiency.",
1.4.5-6,Topic Domain,Organ Transplant Anesthesia,"Anesthetic management for liver, kidney, and other solid organ transplantation.",
1.4.5-7,Topic Domain,Bariatric Surgery Anesthesia,"Physiologic changes of morbid obesity, airway management challenges, dosing considerations, and positioning.",
1.4.6,Branch,Ambulatory Surgery and Non-Operating Room Anesthesia,"Anesthesia in ambulatory surgery centers, office-based settings, and NORA locations.",
1.4.6-1,Topic Domain,Ambulatory Surgery Patient Selection and Optimization,"Criteria for same-day surgery eligibility, medical optimization requirements, and social factors affecting safe discharge.",
1.4.6-2,Topic Domain,Office-Based Anesthesia Safety,"Equipment requirements, emergency preparedness, patient selection, and regulatory considerations for office-based anesthesia.",
1.4.6-3,Topic Domain,Endoscopy Suite Anesthesia,"Anesthetic considerations for upper and lower GI endoscopy, ERCP, and advanced endoscopic procedures.",
1.4.6-4,Topic Domain,Interventional Radiology and Cardiac Catheterization,"Anesthetic management in IR suites and cardiac catheterization labs.",
1.4.6-5,Topic Domain,MRI and Radiation Therapy Anesthesia,"MRI-compatible equipment, ferromagnetic safety, and remote monitoring challenges.",
1.4.6-6,Topic Domain,Electroconvulsive Therapy and Procedural Anesthesia,"Anesthetic management for ECT including seizure optimization and hemodynamic control."
